{"$schema":"https://json-schema.org/draft/2020-12/schema","$id":"urn:skyforge:program-roadmap-proposal:20260927","title":"Skyforge proposed development roadmap","type":"object","additionalProperties":false,"required":["schema_version","schema_id","roadmap_id","status","dispatch_enabled","baseline_commit","snapshot_date","authority","phases","execution","selection_policy","completion_record_contract","failure_policy","nodes","generated_at_utc"],"properties":{"schema_version":{"const":1},"schema_id":{"type":"string"},"roadmap_id":{"type":"string"},"status":{"type":"string"},"dispatch_enabled":{"const":false},"baseline_commit":{"type":"string","pattern":"^[0-9a-f]{40}$"},"snapshot_date":{"type":"string"},"authority":{"type":"object","additionalProperties":false,"required":["director","engineering_manager_role","existing_producer_rule","product_decisions","activation"],"properties":{"director":{"type":"string"},"engineering_manager_role":{"type":"string"},"existing_producer_rule":{"type":"string"},"product_decisions":{"type":"array","items":{"type":"object","additionalProperties":false,"required":["source","decision"],"properties":{"source":{"type":"string"},"decision":{"type":"string"}}}},"activation":{"type":"string"}}},"phases":{"type":"array","items":{"type":"object","additionalProperties":false,"required":["id","name","state","entry","exit"],"properties":{"id":{"type":"string"},"name":{"type":"string"},"state":{"type":"string"},"entry":{"type":"string"},"exit":{"type":"string"}}}},"execution":{"type":"object","additionalProperties":false,"required":["editing","machine_validation","human_validation","no_fallback"],"properties":{"editing":{"type":"string"},"machine_validation":{"type":"string"},"human_validation":{"type":"string"},"no_fallback":{"type":"boolean"}}},"selection_policy":{"type":"object","additionalProperties":false,"required":["preconditions","order","constraints","outcomes"],"properties":{"preconditions":{"type":"array","items":{"type":"string"}},"order":{"type":"array","items":{"type":"string"}},"constraints":{"type":"array","items":{"type":"string"}},"outcomes":{"type":"array","items":{"type":"string"}}}},"completion_record_contract":{"type":"object","additionalProperties":false,"required":["required","criterion_result_values","rule"],"properties":{"required":{"type":"array","items":{"type":"string"}},"criterion_result_values":{"type":"array","items":{"type":"string"}},"rule":{"type":"string"}}},"failure_policy":{"type":"object","additionalProperties":false,"required":["ci","human","authority","no_progress","scope"],"properties":{"ci":{"type":"string"},"human":{"type":"string"},"authority":{"type":"string"},"no_progress":{"type":"string"},"scope":{"type":"string"}}},"nodes":{"type":"array","items":{"type":"object","additionalProperties":false,"required":["id","phase","lane","kind","priority","depends_on","title","objective","observed_state","issue_refs","finding_ids","scope_candidates","acceptance","stop_conditions","dispatch_rule","validation"],"properties":{"id":{"type":"string"},"phase":{"type":"string"},"lane":{"type":"string"},"kind":{"enum":["task","milestone","human_gate","external_gate","expansion"]},"priority":{"type":"integer","minimum":1},"depends_on":{"type":"array","items":{"type":"string"}},"title":{"type":"string"},"objective":{"type":"string"},"observed_state":{"type":"string"},"issue_refs":{"type":"array","items":{"type":"integer"}},"finding_ids":{"type":"array","items":{"type":"string"}},"scope_candidates":{"type":"array","items":{"type":"string"}},"acceptance":{"type":"array","items":{"type":"object","additionalProperties":false,"required":["id","type","criterion"],"properties":{"id":{"type":"string"},"type":{"enum":["human","external","machine_or_document"]},"criterion":{"type":"string"}}},"minItems":1},"stop_conditions":{"type":"array","items":{"type":"string"}},"dispatch_rule":{"type":"string"},"validation":{"type":"object","additionalProperties":false,"required":["existing_workflow_sources","new_evidence_required","reuse_rule","scope_warning"],"properties":{"existing_workflow_sources":{"type":"array","items":{"type":"string"}},"new_evidence_required":{"type":"array","items":{"type":"string"}},"reuse_rule":{"type":"string"},"scope_warning":{"type":"string"}}},"on_rejection":{"type":"array","items":{"type":"string"}},"external_url":{"type":"string"},"advisory_only":{"type":"boolean"}}},"minItems":1},"generated_at_utc":{"type":"string"}}}
