{"schema_version":1,"schema_id":"skyforge-program-roadmap-proposal-20260927","roadmap_id":"skyforge-systems-complete-alpha-20260927","status":"PROPOSED_REFERENCE","dispatch_enabled":false,"baseline_commit":"a50dc8f22eb4b03b588962739db45d5b9966f904","snapshot_date":"2026-09-27","authority":{"director":"Nicholas","engineering_manager_role":"Audit: integrate priorities, evidence and workflow; owning lanes retain technical authority.","existing_producer_rule":"Preserve the active hydrology producer and #1180 atmosphere work. Snapshot states never supersede live issue/claim/PR evidence.","product_decisions":[{"source":"https://github.com/ni-da-ba/skyforge/issues/1063","decision":"Cohesive World after DR-70 and before Bootstrap."},{"source":"https://github.com/ni-da-ba/skyforge/issues/1063#issuecomment-5799031828","decision":"First alpha systems-complete/content-light; bespoke breadth deferred."}],"activation":"Reference/decomposition only until accepted in repository. Existing source-bound roadmap fence stays: M01 after HG-DR70 unless the director explicitly changes that fence. New plan is not a drop-in replacement for Platform-v2 schema 1."},"phases":[{"id":"P0","name":"Core foundation","state":"COMPLETE_FOR_TRANSITION","entry":"Historical accepted foundation","exit":"Maintenance only on concrete consumer defect"},{"id":"P1","name":"Production geography","state":"COMPLETE_FOR_TRANSITION","entry":"Sep-11 reconciliation","exit":"Do not reopen HS-03/04 solely from stale prose; integrated/release quality follow-up remains allowed"},{"id":"P2","name":"First integrated environments","state":"PRIMARY_ACTIVE","entry":"Current #1084/#754 authority","exit":"HG-DR70 accepted"},{"id":"P25","name":"Cohesive World","state":"NEXT_AUTHORIZED_CONDITIONAL","entry":"M01 adopted after HG-DR70","exit":"W08 complete"},{"id":"P3","name":"Bootstrap player slice","state":"PLANNED_WITH_EXISTING_WORK_EXCEPTIONS","entry":"W08; B02/B03/B04 may continue earlier under existing issues","exit":"HG-PLAY accepted"},{"id":"P4","name":"Airspace, visual and audio convergence","state":"PLANNED","entry":"HG-PLAY; W07 allows earlier bounded feasibility","exit":"V04 complete"},{"id":"P45","name":"First public alpha","state":"PLANNED","entry":"L01 candidate","exit":"HG-ALPHA accepted plus explicit publishing authority"},{"id":"P5","name":"Regional sandbox breadth","state":"POST_ALPHA_CONDITIONAL","entry":"Alpha evidence plus explicit bounded scope decision","exit":"Defined in the specific future wave; broad node is never auto-dispatched"},{"id":"P6","name":"Mature engineering","state":"POST_ALPHA_CONDITIONAL","entry":"Alpha evidence plus explicit bounded scope decision","exit":"Defined in the specific future wave; broad node is never auto-dispatched"},{"id":"P7","name":"Adventure and ecology","state":"POST_ALPHA_CONDITIONAL","entry":"Alpha evidence plus explicit bounded scope decision","exit":"Defined in the specific future wave; broad node is never auto-dispatched"},{"id":"P8","name":"High sky and End","state":"POST_ALPHA_CONDITIONAL","entry":"Alpha evidence plus explicit bounded scope decision","exit":"Defined in the specific future wave; broad node is never auto-dispatched"},{"id":"P9","name":"Full experience","state":"POST_ALPHA_CONDITIONAL","entry":"Alpha evidence plus explicit bounded scope decision","exit":"Defined in the specific future wave; broad node is never auto-dispatched"},{"id":"PX","name":"Optional expansion","state":"OPTIONAL","entry":"Alpha evidence plus explicit bounded scope decision","exit":"Defined in the specific future wave; broad node is never auto-dispatched"}],"execution":{"editing":"Accepted edit-only hosted worker or explicitly active external producer.","machine_validation":"GitHub Actions only.","human_validation":"Director/local interactive client.","no_fallback":true},"selection_policy":{"preconditions":["Plan adopted for any new automatic authority","Current main/source fingerprint verified","Current live ownership snapshot available for potentially conflicting work","No unresolved prerequisite or applicable human/external gate","One bounded governing issue and exact path scope","Required evidence/stop conditions are specified"],"order":["Observe active owned work before selecting anything new","Repair concrete correctness/safety blockers on the critical path","Finish existing bounded milestone without widening it","Select eligible node by priority, then stable node ID","Use already-authorized disjoint work when primary path waits"],"constraints":["One governing issue owner; two producers only if scopes and semantic dependencies are independent and controller permits it","Human gate blocks descendants only","Milestones/expansions must decompose; no broad dispatch","No repeated CI polling; resume on material events","No rebase merely for behind count","No expensive rerun without changed risk/dependency surface","No machine completion from merge/issue closure alone"],"outcomes":["RUNNING_EXTERNAL","READY_FOR_BOUNDED_DECOMPOSITION","WAIT_DEPENDENCY","WAIT_CI","WAIT_HUMAN","WAIT_EXTERNAL","WAIT_AUTHORITY","NO_INFORMATION_BEARING_ACTION","COMPLETE_WITH_EVIDENCE"]},"completion_record_contract":{"required":["node_id","criterion_results","source_sha","dependency_surface_identity","evidence_urls","required_workflows_and_results","human_verdict_refs_if_applicable","recorded_by","recorded_at"],"criterion_result_values":["PASS","FAIL","NOT_APPLICABLE_WITH_JUSTIFICATION","UNVERIFIED"],"rule":"All applicable criteria must PASS with attributable evidence; any required human criterion needs explicit scoped owner verdict. A changed dependency surface requires requalification or documented evidence portability."},"failure_policy":{"ci":"Classify compilation, deterministic regression, environment or flaky scheduling. Repair only affected scope; no rerun of unchanged failure without a stated diagnostic hypothesis.","human":"Record CHANGES_REQUIRED against exact artifact; reopen only affected nodes and material-delta criteria. Never auto-submit identical artifact.","authority":"Hold the conflicting task; continue disjoint eligible work. Do not retire unknown active claims.","no_progress":"After two attempts with the same failure cause and no information gain, stop extending scope and request a bounded diagnosis/review. Session restart still requires applicable owner authorization.","scope":"New product semantics, numeric product budgets, permissions or destructive change go to director at their actual trigger."},"nodes":[{"id":"G01","phase":"P2","lane":"Audit","kind":"task","priority":1,"depends_on":[],"title":"Repair startup authority and current frontiers","objective":"Reconcile non-source-bound execution, lane and bootstrap contradictions while keeping source-bound roadmap changes staged.","observed_state":"NEEDS_RECONCILIATION","issue_refs":[],"finding_ids":["SF-A01","SF-A04","SF-A35"],"scope_candidates":["docs/agent-state/**","docs/audit/**","AGENTS.md","CONTRIBUTING.md"],"acceptance":[{"id":"G01-AC1","type":"machine_or_document","criterion":"Execution instructions agree on edit-only hosted work versus Actions validation and local manual evidence."},{"id":"G01-AC2","type":"machine_or_document","criterion":"Current frontier records exact source and separates implemented, tested and human-accepted state; no H6 restart."},{"id":"G01-AC3","type":"machine_or_document","criterion":"Current active issues/PRs are represented without rewriting producer technical authority."}],"stop_conditions":["Do not edit PROGRAM_ROADMAP/PROGRAM_PROGRESSION fingerprints until M01 entry or an explicit director override."],"dispatch_rule":"Bind one governing issue, verify exclusive live claim, narrow exact allowed paths and required workflows before dispatch.","validation":{"existing_workflow_sources":["https://github.com/ni-da-ba/skyforge/blob/a50dc8f22eb4b03b588962739db45d5b9966f904/.github/workflows/ci.yml","https://github.com/ni-da-ba/skyforge/blob/a50dc8f22eb4b03b588962739db45d5b9966f904/.github/workflows/orchestrator-smoke.yml"],"new_evidence_required":[],"reuse_rule":"Reuse expensive evidence only when its dependency surface is unchanged and the candidate's required cheap checks pass.","scope_warning":"These are available baseline entry points, not an assertion that they already cover every criterion."}},{"id":"G02","phase":"P2","lane":"Audit","kind":"task","priority":2,"depends_on":[],"title":"Recover verifiable ownership and durable producer handoffs","objective":"Read current Platform-v2 claims, preserve local atmosphere delta and map one active branch/PR per task.","observed_state":"NEEDS_RECONCILIATION","issue_refs":[349,1180],"finding_ids":["SF-A05","SF-A06","SF-A07","SF-A34"],"scope_candidates":["docs/agent-state/**","docs/audit/**","AGENTS.md","CONTRIBUTING.md"],"acceptance":[{"id":"G02-AC1","type":"machine_or_document","criterion":"Authenticated development-state snapshot has capture time, runtime SHA and active claims."},{"id":"G02-AC2","type":"machine_or_document","criterion":"#1180 local port has one identified surviving claimed PR; hydrology producer stays on its own issue."},{"id":"G02-AC3","type":"machine_or_document","criterion":"Every open PR is classified; preserved evidence is explicitly excluded from cleanup."}],"stop_conditions":["Unavailable live ownership blocks conflicting mutation; never reset a producer or delete a branch merely due to age."],"dispatch_rule":"Bind one governing issue, verify exclusive live claim, narrow exact allowed paths and required workflows before dispatch.","validation":{"existing_workflow_sources":["https://github.com/ni-da-ba/skyforge/blob/a50dc8f22eb4b03b588962739db45d5b9966f904/.github/workflows/ci.yml","https://github.com/ni-da-ba/skyforge/blob/a50dc8f22eb4b03b588962739db45d5b9966f904/.github/workflows/orchestrator-smoke.yml"],"new_evidence_required":[],"reuse_rule":"Reuse expensive evidence only when its dependency surface is unchanged and the candidate's required cheap checks pass.","scope_warning":"